Path,Output class,Current A,Rds or Ron ohm,Temperature multiplier,Estimated dissipation W,Status,Notes
SIDR626LDP external MOSFET,High current OUT2,18,0.0021,2.0,1.36,Needs thermal validation,Conservative conduction estimate only; excludes switching and inrush
SIDR626LDP external MOSFET,Medium current 12A channel,12,0.0021,2.0,0.60,Needs thermal validation,Applies to OUT1 class
SIDR626LDP external MOSFET,Medium current 8A channel,8,0.0021,2.0,0.27,Needs thermal validation,Applies to OUT3 OUT4 OUT6 OUT7 OUT10 class
SIDR626LDP external MOSFET,Low current 4A channel,4,0.0021,2.0,0.07,Rev.1 baseline estimate,Applies to OUT5 OUT8 OUT9; controller losses excluded
TPS2HB35 integrated switch,Low current 4A channel,4,0.035,2.0,1.12,Deferred alternate,Not Rev.1 baseline after ADR-0011
TPS2HB16 integrated switch,Low current 4A channel,4,0.016,2.0,0.51,Deferred alternate,Not Rev.1 baseline after ADR-0011
LM74700 external MOSFET,Board input 40A budget,40,0.0021,2.0,6.72,Needs different MOSFET or paralleling,Input reverse MOSFET must be selected separately for board-level current
