Check ID,Review item,Required close evidence,Primary artifacts,Pass condition,Blocked action
Q1-FRZ-001,Controller gate default,LM74930-Q1 controller-unpowered off state Q1_DGATE Q2_HGATE common-source and RGE package behavior reviewed,PB-100-input-reverse-package-trace.csv; PB-100-input-controller-pin-template.csv; PB-100-input-protection-pin-contract.csv,Controller gate drive keeps Q1 and Q2 off when controller is unpowered and preserves reverse-polarity safe behavior,Do not lock final controller peripheral values before schematic review
Q1-FRZ-002,Gate clamp discharge and turn-off timing,Q1_DGATE Q2_HGATE hard-cutoff 100nF CAP-to-VS and turn-off timing values reviewed against Q1/Q2 gate stress,PB-100-input-power-design-values.csv; PB-100-input-controller-pin-template.csv; PB-100-input-reverse-freeze-review.csv,Gate topology cutoff mode and timing values are selected final pre-layout,Do not release schematic freeze until peripheral values are promoted and ERC/netlist review passes
Q1-FRZ-003,Rejected 60 V paths,IAUTN06S5N008ATMA1 TOLL and dual SIDR626LDP remain historical evidence and are not approved Rev.1 assembly substitutions,PB-100-input-reverse-package-trace.csv; PB-100-input-reverse-protection.md; PB-100-thermal-estimates.csv,No selected schematic or BOM path uses a 60 V Q1 MOSFET,Do not reintroduce a 60 V Q1 path without Product Owner review and overshoot proof
Q1-FRZ-004,Selected 80 V TOLL path,IAUT300N08S5N012ATMA2 80 V TOLL 1.2mΩ 4.032W at 40A is selected by Product Owner,PB-100-input-reverse-package-trace.csv; PB-100-input-q1-evidence.csv; PB-100-mosfet-voltage-margin-review.md; production/bom/pb100_sourcing_evidence_snapshot.csv,Q1 value symbol pin map footprint BOM thermal and sourcing records remain synchronized,Do not waive the later plane/polygon/bus solder-void or prototype thermal gates
Q1-FRZ-005,80 V alternatives,IAUT300N08S5N014ATMA1 TOLL same-footprint and BUK7J2R4-80MX LFPAK56E non-drop-in paths remain documented controlled alternatives,PB-100-input-reverse-package-trace.csv; PB-100-input-reverse-protection.md; PB-100-thermal-estimates.csv,Two controlled alternatives preserve 80 V but require electrical or pin-map footprint SOA thermal and sourcing review,Do not substitute either alternative automatically
Q1-FRZ-006,Protected measurement sequence,Q2 and Q1 meet at INPUT_COMMON_SOURCE then feed VBAT_REV_PROT and the total-current shunt IIN_SHUNT_HI IIN_SHUNT_LO feeds VBAT_PROT,PB-100-input-protection-pin-contract.csv; PB-100-schematic-net-domain-plan.csv; PB-100-current-telemetry-freeze-review.csv,Total-current telemetry measures protected board current and cannot bypass reverse protection shunt or firmware-visible 40 A budget enforcement,Do not move total-current measurement ahead of reverse protection or connect downstream loads to VBAT_REV_PROT
Q1-FRZ-007,40 A thermal copper and SOA audit,Q1 4.032W at 40 A uses passive PCB copper plus enclosure cooling Tj <=150 C and full path <=6.20 K/W at 125 C ambient,PB-100-input-q1-evidence.csv; PB-100-board-current-budget-design-calculation.md; PB-100-board-current-budget-freeze-review.csv; PB-100-input-reverse-freeze-review.csv,Q1 design selection passes while physical copper enclosure interface and PB-BENCH-010 remain later gates,Do not route high-current copper or place Q1 before schematic freeze
Q1-FRZ-008,Assembly sourcing and alternatives,JLCPCB PCBWay TOLL handling selected-part active/preferred production status and two controlled 80 V alternatives are reviewed,PB-100-assembly-readiness-trace.csv; PB-100-factory-production-evidence.csv; production/bom/pb100_assembly_sourcing_recheck.csv; production/bom/factory_bom_draft.csv,Selected and alternate Q1 packages keep production sourcing and factory assembly feasibility evidence,Do not generate pick-place or assembly output before sourcing recheck
Q1-FRZ-009,No-layout boundary,Q1 placement copper vias thermal relief Gerbers drills pick-place and PB-100.kicad_pcb remain blocked before schematic freeze,PB-100-schematic-freeze-checklist.md; PB-100-kicad-prep.md; tools/validate_pb100.py,No PCB layout current-carrying geometry manufacturing output or PB-100.kicad_pcb exists before schematic freeze,Do not create layout or manufacturing outputs from this checklist
