Sheet file,Sheet kind,Purpose,Primary artifacts,Status,Capture gate
PB-100.kicad_sch,top,Top-level sheet title block review notes and child sheet links,PB-100-schematic-capture-plan.md,Scaffold,Child sheets linked and ERC clean before schematic freeze
input-protection.kicad_sch,child,Battery input reverse protection TVS input current and voltage sense,PB-100-input-reverse-package-trace.csv; PB-100-input-reverse-freeze-review.csv; PB-100-input-reverse-q1-freeze-checklist.csv; PB-100-input-reverse-q1-derivation-precheck.csv; PB-100-input-reverse-q1-closeout-precheck.csv; PB-100-board-current-budget-trace.csv; PB-100-board-current-budget-freeze-review.csv; PB-100-board-current-budget-design-calculation.md; PB-100-board-current-budget-value-freeze-checklist.csv; PB-100-board-current-budget-value-derivation-precheck.csv; PB-100-tvs-load-dump-margin-trace.csv; PB-100-tvs-load-dump-freeze-review.csv; PB-100-tvs-overshoot-escape-checklist.csv; PB-100-tvs-overshoot-validation-precheck.csv; PB-100-input-protection-pin-contract.csv; PB-100-input-controller-pin-template.csv; PB-100-current-monitor-pin-template.csv; PB-100-input-power-design-values.csv; PB-100-protection-validation.csv,Scaffold,Input protection references 40 A budget and Q1 closeout precheck reviewed
logic-power.kicad_sch,child,Protected PB_5V_OUT buck rail power-good UVLO and filters,PB-100-logic-power-rail-trace.csv; PB-100-logic-power-freeze-review.csv; PB-100-logic-power-value-freeze-checklist.csv; PB-100-logic-power-value-derivation-precheck.csv; PB-100-logic-buck-pin-template.csv; PB-100-logic-power-design-values.csv; PB-100-logic-power-design-placeholders.csv; PB-100-logic-power-budget.csv,Scaffold,Logic rail values and power-good behavior reviewed
output-channel-template.kicad_sch,child,Generic high-side output channel template,PB-100-high-medium-output-baseline-trace.csv; PB-100-high-medium-output-freeze-review.csv; PB-100-low-current-output-baseline-trace.csv; PB-100-low-current-output-freeze-review.csv; PB-100-output-stage-value-freeze-checklist.csv; PB-100-output-stage-value-derivation-precheck.csv; PB-100-output-stage-closeout-precheck.csv; PB-100-output-controller-pin-template.csv; PB-100-output-channel-pin-contract.csv; PB-100-output-stage-design-values.csv,Template scaffold,Template remains role-agnostic closeout-precheck traceable and can instantiate OUT1 through OUT10
outputs-1-10.kicad_sch,child,Ten generic output channel instances,PB-100-high-medium-output-baseline-trace.csv; PB-100-high-medium-output-freeze-review.csv; PB-100-low-current-output-baseline-trace.csv; PB-100-low-current-output-freeze-review.csv; PB-100-output-stage-value-freeze-checklist.csv; PB-100-output-stage-value-derivation-precheck.csv; PB-100-output-stage-closeout-precheck.csv; PB-100-schematic-instance-symbol-map.csv; PB-100-output-net-expansion.csv; PB-100-output-channel-pin-contract.csv,Scaffold,All output references captured with generic OUT names and closeout-precheck trace only
telemetry.kicad_sch,child,Total current voltage thermal board ID and monitor options,PB-100-current-telemetry-trace.csv; PB-100-current-telemetry-freeze-review.csv; PB-100-current-telemetry-value-freeze-checklist.csv; PB-100-current-telemetry-value-derivation-precheck.csv; PB-100-thermal-telemetry-trace.csv; PB-100-thermal-telemetry-freeze-review.csv; PB-100-thermal-telemetry-value-freeze-checklist.csv; PB-100-thermal-telemetry-value-derivation-precheck.csv; PB-100-thermal-telemetry-map.csv; PB-100-current-telemetry-map.csv; PB-100-fault-response-matrix.csv,Scaffold,Telemetry ranges ADC mapping current thermal freeze reviews and stale-fault behavior reviewed
b2b-interface.kicad_sch,child,JPB1 PB-100 to LB-100 interface,PB-100-b2b-interface-trace.csv; PB-100-b2b-pin-map.csv; PB-100-b2b-pin-budget.csv; PB-100-b2b-lb100-resource-binding.csv; PB-100-b2b-lb100-pin-audit-checklist.csv; PB-100-b2b-interface-freeze-checklist.csv; PB-100-b2b-interface-closeout-precheck.csv,Scaffold,FX18 candidate pin assignment and closeout precheck tracked while footprint placement remains blocked
can1-safety.kicad_sch,child,CAN1 TX-disable readback and DNP/open TX path,PB-100-can1-tx-disable-trace.csv; PB-100-can1-tx-disable.md; PB-100-can1-safety-verification.csv; PB-100-can1-production-dnp-review.csv; PB-100-can1-default-disable-freeze-checklist.csv; PB-100-can1-default-disable-derivation-precheck.csv; PB-100-schematic-net-domain-plan.csv,Scaffold,DNP/open TX route default disable production DNP and status readback reviewed
