Gate,Status,Evidence,Decision,Blocked action
Schematic freeze,Open,PB-100-schematic-freeze-checklist.md; PB-100-schematic-review-closeout.md,PB-100 freeze is reopened for 60/80 V margin FX18 mechanics and final value/footprint promotion,Do not create or update PB-100.kicad_pcb until every conditional freeze gate closes
KiCad schematic value review,Open,kicad/PB-100.kicad_sch; kicad/sheets/*.kicad_sch; PB-100-schematic-readiness-review.md,CAN1 topology is value-bearing but the remaining preliminary class instances and empty Footprint properties are not a final schematic,Do not use the preliminary sheet set as a PCB netlist until controlled symbol promotion and value review close
Footprint binding,Open,PB-100-footprint-binding-inventory.csv; PB-100-kicad-footprint-plan.csv; PB-100-symbol-mpn-readiness.csv; PB-100-symbol-pin-evidence.csv; PB-100-symbol-footprint-pad-map.csv; PB-100-footprint-binding-progress.csv; PB-100-footprint-binding-progress.md; PB-100-footprint-binding-closeout-2026-07-20.md; PB-100-footprint-binding-closeout-2026-07-20-power-telemetry.md; PB-100-footprint-binding-closeout-2026-07-20-mosfet-packages.md; kicad/lib/PB100.pretty,FX18 JPB1 remains open because its footprint has 100 signal SMD pads but no MF/TH mechanical pads; other local package sources remain review inputs and schematic symbols still contain empty Footprint properties,Do not create or update PB-100.kicad_pcb until the official Hirose MF/TH land pattern and controlled schematic symbol promotion close
Mechanical envelope,Open,PB-100-mechanical-envelope-inventory.csv; PB-100-mechanical-layout-inputs.csv; PB-100-mechanical-layout-input-closeout.md; PB-100-garage-connector-fuse-plan.md; PB-100-b2b-interface-closeout-precheck.csv; PB-100-input-reverse-package-trace.csv,Board outline high-current power copper fuse and service zones are reviewed but JPB1 mechanical retention is open until the official FX18 MF/TH features are present in the footprint,Do not create or update PB-100.kicad_pcb until JPB1 MF/TH mechanics thermal/current layout model and controlled schematic symbol promotion close
DFM/DRC baseline,Ready,production/board-order/three_board_layout_rules.md,Use conservative JLCPCB/PCBWay-compatible layout-start rules and do not use vendor minimums as default design values,Do not relax trace spacing via package fiducial panel or edge-clearance rules without documented DFM review
Thermal/current layout model,Open,PB-100-board-current-budget-design-calculation.md; PB-100-thermal-estimates.csv; PB-100-output-stage-design-values.csv,High-current copper must be sized by current thermal rise fuse coordination connector derating and return path review,Do not route PB-100 power copper using signal DRC minimums
Manufacturing output boundary,Closed,production/board-order/three_board_jlcpcb_order_readiness.csv; production/board-order/three_board_layout_start_readiness.csv,PCB layout-start work does not authorize fabrication assembly or order artifacts,Do not generate Gerbers drills pick-place BOM/CPL manufacturing ZIP fabrication package or PCBA order
