Mechanical item,Scope,Evidence,Current state,Review state,Board-import impact,Next action
Board outline and enclosure keepout,Overall PB-100 board,PB-100-mechanical-layout-inputs.csv; PB-100-mechanical-layout-input-closeout.md; PB-100-garage-connector-fuse-plan.md; production/board-order/three_board_layout_rules.md,Reviewed 150.0 mm x 90.0 mm PB-100 prototype board outline datum enclosure keepout and cable-exit assumptions exist,Closed,MECHANICAL_INPUT_CLOSED,Apply reviewed PB-100 outline during controlled board import after thermal/current and symbol-promotion gates close
Mounting holes and service cover,Mechanical retention,PB-100-mechanical-layout-inputs.csv; PB-100-mechanical-layout-input-closeout.md; PB-100-garage-connector-fuse-plan.md,Reviewed four-corner M3 NPTH mounting pattern and service-cover keepout are dimensioned,Closed,MECHANICAL_INPUT_CLOSED,Apply M3 keepouts during board import and review final service-cover enclosure CAD before manufacturing package
Battery input entry,High-current battery path,PB-100-mechanical-layout-inputs.csv; PB-100-mechanical-layout-input-closeout.md; PB-100-garage-connector-fuse-plan.md; PB-100-board-current-budget-design-calculation.md,Reviewed off-board 50A fused high-current battery harness entry corridor is defined on the X=0 edge,Closed,MECHANICAL_INPUT_CLOSED,Apply off-board battery entry corridor and review gland strain relief during enclosure CAD and harness closeout
OUT1 and OUT2 DTP exits,High-current output connectors,PB-100-mechanical-layout-inputs.csv; PB-100-mechanical-layout-input-closeout.md; PB-100-garage-connector-fuse-plan.md; PB-100-garage-purchase-kit-candidates.csv,Reviewed off-board DTP harness exit zones for generic OUT1 and OUT2 are dimensioned without locking PCB-mounted housings,Closed,MECHANICAL_INPUT_CLOSED,Apply OUT1 and OUT2 high-current exit keepouts and close exact DTP shells boots and bend radius before harness release
OUT3 through OUT10 DT exits,Medium and low-current output connectors,PB-100-mechanical-layout-inputs.csv; PB-100-mechanical-layout-input-closeout.md; PB-100-garage-connector-fuse-plan.md; PB-100-garage-purchase-kit-candidates.csv,Reviewed off-board DT harness exit zones for generic OUT3..OUT10 are dimensioned without role-specific connector binding,Closed,MECHANICAL_INPUT_CLOSED,Apply OUT3..OUT10 DT exit keepouts and close exact DT shells boots and labels before harness release
Fuse service access,User-serviceable fuses,PB-100-mechanical-layout-inputs.csv; PB-100-mechanical-layout-input-closeout.md; PB-100-garage-connector-fuse-plan.md; production/bom/garage_bom_draft.csv,Reviewed off-board fuse service-cover zone is defined and preserves generic OUT1..OUT10 labeling,Closed,MECHANICAL_INPUT_CLOSED,Apply fuse service keepout and review MINI or ATO holder orientation before enclosure and garage harness release
JPB1 stack and placement,PB/LB mezzanine,PB-100-mechanical-layout-inputs.csv; PB-100-mechanical-layout-input-closeout.md; PB-100-b2b-interface-closeout-precheck.csv; LB-100-jpb1-resource-budget.csv,Reviewed centered JPB1 FX18 datum and 20mm stack planning height are defined for PB/LB mating,Closed,MECHANICAL_INPUT_CLOSED,Apply centered JPB1 datum and review pin-1 mirroring board spacing and vibration retention during controlled board import
Power copper and thermal zones,High-current copper placement,PB-100-mechanical-layout-inputs.csv; PB-100-mechanical-layout-input-closeout.md; PB-100-thermal-estimates.csv; PB-100-output-stage-design-values.csv; PB-100-board-current-budget-design-calculation.md,Reviewed high-current input OUT1/OUT2 OUT3..OUT10 and thermal sensor placement zones are defined without routing copper,Closed,MECHANICAL_INPUT_CLOSED,Apply high-current placement zones and close copper width SOA shunt TVS and fuse coordination in the thermal/current layout model
CAN service and signal exits,Low-current harness interface,PB-100-mechanical-layout-inputs.csv; PB-100-mechanical-layout-input-closeout.md; PB-100-garage-connector-fuse-plan.md; PB-100-can1-tx-disable.md,Reviewed low-current CAN1 service exit corridor is separated from power exits and preserves CAN1 TX DNP/open boundary,Closed,MECHANICAL_INPUT_CLOSED,Apply CAN/service exit keepout and close EMC routing review while preserving CAN1 TX DNP/open default
