Blocker ID,Stage,Stage status,Required evidence,Current evidence,Authorization after close,Current blocker authorization,Blocked scope
PBREL-006,Pre-layout design,Closed,Selected Q1 exact MPN package 40 A hot loss passive cooling target and full thermal-path limit,IAUT300N08S5N012ATMA2 with generated 4.032 W loss Tj <=150 C and <=6.20 K/W full path is reviewed under ADR-0018,LAYOUT-ONLY,LAYOUT-ONLY,Prototype Gerber/BOM production and field use remain blocked
PBREL-006,Post-layout verification,Blocked,Reviewed Q1 copper current-density solder-void thermal-interface and enclosure extraction proving the <=6.20 K/W full passive path,No PB-100.kicad_pcb or extracted copper/thermal report exists,PROTO-ONLY,LAYOUT-ONLY,Engineering-prototype Gerber/BOM production and field use remain blocked
PBREL-006,Prototype qualification,Blocked,PB-BENCH-010 measured 40 A current-budget and Q1 junction/case/enclosure thermal record,No assembled PB-100 prototype or PB-BENCH-010 record exists,PRODUCTION-READY,LAYOUT-ONLY,Production and field use remain blocked
PBREL-007,Pre-layout design,Closed,Selected LM74930-Q1 hard-cutoff branch covering 79-101 V 0.5-4 ohm 40-400 ms 25/125 C initial Tj with cutoff <=55 V linear-mode SOA and Q2 hot-loss evidence,ADR-0018 selects LM74930QRGERQ1 plus IAUTN15S6N025ATMA1; 16 corners give 48.99-54.89 V cutoff 8.09 us turnoff 1.67x hot SOA margin and 7.200 W hot conduction with a 3.47 K/W post-layout limit,LAYOUT-ONLY,LAYOUT-ONLY,Prototype Gerber/BOM production and field use remain blocked; PBREL-007 remains Conditional overall
PBREL-007,Post-layout verification,Blocked,Reviewed common-source power path copper thermal and clamp-loop extraction covering parasitic inductance overshoot Q2 dynamic SOA and the <=3.47 K/W full thermal path,No PB-100.kicad_pcb or extracted common-source/clamp-loop/thermal report exists,PROTO-ONLY,LAYOUT-ONLY,Engineering-prototype Gerber/BOM production and field use remain blocked; PBREL-007 remains Conditional overall
PBREL-007,Prototype qualification,Blocked,PB-BENCH-004 surge-fixture cutoff overshoot thermal and repeated-pulse record on the engineering prototype,No assembled PB-100 prototype or PB-BENCH-004 record exists,PRODUCTION-READY,LAYOUT-ONLY,Production and field use remain blocked; PBREL-007 remains Conditional overall
