Function,Preferred MPN,Preferred supplier code,Preferred package,Alternatives,Use,Status,Source
High-side controller,TPS48110AQDGXRQ1,LCSC C17556513,19-VSSOP,TPS48111LQDGXRQ1; TPS12110AQDGXRQ1; TPS48100QDGXRQ1,High and medium output channels,Candidate,https://www.lcsc.com/product-image/C17556513.html
Smart high-side switch,TPS2HB35BQPWPRQ1,LCSC C3230080,HTSSOP-16-EP,TPS2HB16FQPWPRQ1 LCSC C2879380; TPS1HB35FQPWPRQ1 LCSC C3230072,Low-current output channels,Conditional on rail clamp below device limit,https://www.lcsc.com/product-detail/power-distribution-switches_texas-instruments-tps2hb35bqpwprq1_C3230080.html
Output MOSFET,SIDR626LDP-T1-RE3,LCSC C3279576,PowerPAK-SO-8DC,JMSL0606AGQ-13 LCSC C7527409; Infineon OptiMOS automotive 60V TBD,External high-side controller channels,Candidate,https://www.lcsc.com/product-detail/C3279576.html
Reverse protection controller,LM74700QDBVRQ1,LCSC C2941042,SOT-23-6,LM74700QDRQ1 LCSC C33579657; LM74502-Q1 family,Battery input reverse-polarity protection,Candidate,https://www.lcsc.com/product-detail/C2941042.html
Input TVS,SM8S33A class,TBD,DO-218AB,SMCJ33A-Q; SMBJ33A; SMCJ33A,Input load-dump clamp for 60V+ devices,Conditional not for direct 40V smart-switch rail,https://www.mccsemi.com/products/esd-protection-and-power-tvs/tvs/SM8S33A
Logic buck regulator,LM5164QDDATQ1,LCSC C1850350,SO-8,TPS54360B-Q1; TPS54360-Q1,PB-100 logic rail,Candidate,https://www.lcsc.com/product-detail/C1850350.html
