Gate,Blocker ID,Status,Blocking evidence,Required close evidence,Next engineering action,Layout impact
MCU and pin binding,LBREL-001,Closed,LB-100-stm32h563-pin-binding-precheck.csv and the exported LB-100 netlist close the STM32H563VITx LQFP100 package source exact JPB1 pin binding clock reset boot SWD USB power/reference and alternate-family review,Closed: exact STM32H563VITx LQFP100 pin-to-net and pin-to-footprint binding is date-stamped and validator-checked,Retain the accepted pin binding during layout and the separate signal-integrity closeout,Closed blocker; LB-100 board import is EVT-LAYOUT-AUTHORIZED and signal integrity closes at EVT-FAB-REVIEW
Power tree and sleep budget,LBREL-002,Closed,LB-100-rail-budget-closeout-precheck.csv and LB-100-rail-tree-precheck.csv close the calculated 229.2 mA sustained 381.2 mA service peak 500 mA PB_5V_OUT no-back-power sleep/deep-sleep and load-switch boundary including the FB-100 indication worst case,Closed: calculated rail tree active service peak sleep USB no-back-power and FB UI load evidence are validator-covered,Carry closed rail budget into layout and keep PB-100 LM5013 fallback only if later BOM exceeds 500 mA,Closed blocker; LB-100 PCB import is EVT-LAYOUT-AUTHORIZED and rail verification remains in EVT-FAB-REVIEW
PB-100 interface,LBREL-003,Closed,PB-100-fx18-paired-stack-closeout.md corrects the pair to FX18-100P-0.8SV10 plus FX18-100S-0.8SV10 and closes the official 20 mm stack 20.3 +/-0.127 mm four-spacer retention six-land GND MF mirrored pin-1 fixture and inspection evidence,Closed pre-layout under ADR-0013; physical PB-BENCH-014 and PB-BENCH-015 remain mandatory before motorcycle power field use or production release,Carry the reviewed pair shared stack holes and four-spacer pattern into controlled board import,Closed blocker; LB board import is EVT-LAYOUT-AUTHORIZED and physical validation remains a production-release gate
CAN and expansion safety,LBREL-004,Closed,ADR-0015 candidate A is Accepted; PB owns the transceiver ESD termination CANH CANL and harness while LB owns FDCAN protocol and read-only firmware. Exported PB and LB netlists prove the ownership boundary with no transmit bypass,Closed: ownership sourcing rail budget and exact PB/LB topology are synchronized while CAN2 LIN RS485 UART/SPI remain separate and DNP by default,Preserve both PB DNP hardware links and keep CAN2/LIN/RS485 separate during the signal-integrity layout-model closeout,Closed blocker; LB-100 board import is EVT-LAYOUT-AUTHORIZED and safety verification closes at EVT-FAB-REVIEW
Service storage and sensors,LBREL-005,Closed,The E73 powered-off defect temporarily made this gate Conditional; the corrected schematic powers U15-U17 SN74LVC1G125-Q1 from RADIO_SENSOR_3V3 isolates both UART directions and reset and clamps module-side leakage below 0.222 V while preserving USB storage RTC FRAM BMI270 and lux topology,Closed: datasheet calculation exported-netlist rules and ERC prove exact service storage sensor and powered-off isolation topology,Preserve the switched buffer rail module-side pulls decoupling antenna/optical keepouts and socket access during layout review,Closed blocker after corrective evidence; LB layout is authorized and placement-specific SI RF optical checks remain in EVT-FAB-REVIEW
Factory assembly readiness,LBREL-006,Closed,LB-100-mcu-sourcing-precheck.csv and LB-100-component-sourcing-precheck.csv record current accepted MCU regulator transceiver BLE storage sensor RTC microSD USB-boundary crystal and load-switch sourcing evidence with alternatives where critical,Closed: critical LB-100 factory assembly sourcing evidence schematic values and footprint bindings are date-stamped and validator-covered,Transfer accepted designators and values into the preliminary BOM while keeping live-stock and production process checks open,Closed blocker; layout is authorized while BOM lock pick-place and order package remain blocked until EVT-FAB-AUTHORIZED
KiCad schematic implementation,LBREL-007,Closed,The direct E73 topology temporarily made this gate Conditional; LB-100.kicad_sch now exports a 99-component 199-net footprint-bound XML netlist with U15-U17 Ioff isolation typed IC pins ADC_REF/AGND digital VBUS detection direct LTC3212 timing back-power-safe sensors independent FOG_A_SW_IN/FOG_B_SW_IN secondary paths ADR-0021 PB-owned primary cable-entry protection and ADR-0015 logic-only CAN1,Closed: tools/validate_board_schematics.py checks exact powered-off radio USB dual-fog topology safety/interface nets every symbol-to-footprint pad contract non-passive IC pin types deterministic generation and ERC with only the reviewed USB_CC1/USB_CC2 cross-board warnings,Carry the accepted ADR-0020 dual-input amendment and ADR-0021 ownership into controlled layout without changing generic output architecture,Closed blocker after corrective evidence; LB PCB layout is authorized and manufacturing output remains NO-GO until EVT-FAB-AUTHORIZED
