Rail,Source,Load scope,Budget state,Active budget mA,Sleep/deep-sleep boundary,Required close evidence,Blocked action
PB_5V_OUT input,PB-100 protected buck,Feeds LB-100 local regulation and service domains,Closed,500 mA allocation; 219.2 mA base sustained and 415.2 mA service peak closeout,Must not back-power PB-100 from USB VBUS SWD or signal pins; load switches off before sleep,LB-100-rail-budget-closeout-precheck.csv proves calculated active/service budget no-back-power and sleep boundaries,Do not exceed 500 mA or create layout without updating PB-100 logic-power budget
LB_3V3_MAIN,PB_5V_OUT via LB-100 regulator,MCU clocks storage sensors transceivers and status pull-ups,Closed,219.2 mA base sustained allocation before optional expansion,Regulator remains controlled by PB_PWR_GOOD; nonessential loads off in sleep/deep-sleep,XC6220B331MR-G and AMS1117 fallback sourcing plus regulator-loss budget closeout,Do not place regulator footprint before schematic thermal review confirms package escape
LB_3V3_IO,LB_3V3_MAIN or controlled IO rail,PB-side pull-ups status inputs and JPB1 logic reference,Closed,5 mA default pull-up/status allocation 10 mA peak,Invalid while LB-100 reset/unpowered and cannot enable PB outputs,Pin-binding plus rail closeout proves sequencing and no-back-power boundary,Do not drive PB interfaces from uncontrolled or USB-powered rail
VBUS_SERVICE,USB-C service connector,USB attach detection service/debug and optional device power sensing,Closed,0 mA system-supply allocation; 2 mA sense-only peak,Must not back-power PB_5V_OUT LB_3V3_IO or PB-100,USB VBUS is sense-only in LB-100-service-storage-sensor-precheck.csv and FB signal plan,Do not connect VBUS to system rails without ADR/power-model review
BACKUP_AON,Local coin/supercap or main rail derived,RTC FRAM wake and retention logic if populated,Closed,0.2 mA RTC active allocation with 100 nA-class RTC quiescent source evidence,Only RTC backup domain remains always-on and must satisfy ADR-0012,DS3231MZ+TRL sourcing and rail closeout bound always-on load,Do not add always-on loads without parking-current evidence
RADIO_SENSOR,Controlled 3V3 or load-switched domain,BLE IMU lux and external sensors,Closed,27 mA base active sensor/radio allocation 58 mA peak,BLE/sensors load-switched or low-power before sleep,E73 nRF52840-class BLE BMI270/BMA456 and VEML7700/BH1750 sourcing evidence,Do not substitute WiFi/high-current radio without budget update
MICROSD,Controlled 3V3 domain,microSD socket and level/ESD support,Closed,0 mA sustained 100 mA service/write peak,Power-switch off in sleep/deep-sleep,TF-015/LCK microSD sourcing and rail closeout bound write-current peak,Do not connect microSD directly to always-on rail
TRANSCEIVER,Controlled 3V3 or 5V as required,CAN1 CAN2 LIN RS485 and UART transceivers,Closed,25 mA CAN1 default allocation 160 mA expansion peak DNP,CAN1 TX DNP/open; CAN2 LIN RS485 default DNP/off,Communication safety precheck and sourcing evidence bind transceiver standby/DNP policy,Do not populate expansion transceivers without budget and safety review
