Check ID,Scope,Evidence,Close result,Status,Blocked action
FB-UI-001,Role-free channel LEDs,"FB-100-interface-pinout-closeout.csv maps CH_LED_1..CH_LED_10 to logical OUT1..OUT10 only; FB-100-component-sourcing-precheck.csv records discrete LED and passive source classes","Closed: channel indication is role-free and has source/value family evidence",Closed,"Do not put accessory names in FB-100 net names silkscreen or LED labels"
FB-UI-002,Status RGB,"FB-100-component-sourcing-precheck.csv records RGB LED classes plus SK6812/WS2812 built-in-IC alternates; STATUS_RGB_DATA remains a generic system status signal","Closed: status indication has selectable discrete or smart-RGB implementation path",Closed,"Do not encode accessory roles in status LED hardware"
FB-UI-003,Buttons,"FB-100-component-sourcing-precheck.csv records SERVICE and RESET switch candidates; interface pinout defines active-low pulled inputs with reset routed only through LB supervisor behavior","Closed: button behavior is service/reset only and cannot enable outputs",Closed,"Do not share button nets with output-enable hardware"
FB-UI-004,Optional OLED,"FB-100-component-sourcing-precheck.csv records 0.96 inch and 0.91 inch OLED candidates; JFB1 reserves OLED_SCL OLED_SDA and OLED_RST_OR_INT_DNP","Closed: OLED is DNP by default and optional service UI only",Closed,"Do not make OLED mandatory for safe operation or consume role-mapped output pins"
FB-UI-005,Passives and debounce,"FB-100-component-sourcing-precheck.csv records basic resistor/capacitor source path for LED current limits CC resistors pulls VBUS divider and debounce RC","Closed: passive value families are selected while exact values stay in schematic review",Closed,"Do not lock BOM/CPL values before schematic value review"
FB-UI-006,No-layout boundary,"No FB-100.kicad_pcb Gerbers drills pick-place BOM/CPL order package or manufacturing ZIP exists; validate_board_order checks this boundary","Closed: UI control review authorizes schematic capture only and blocks PCB layout until whole FB-100 freeze closes",Closed,"Do not create FB-100 PCB layout or manufacturing outputs from this precheck"
