Gate,Blocker ID,Status,Blocking evidence,Required close evidence,Next engineering action,Layout impact
LB-100 interface,FBREL-001,Closed,FB-100-interface-pinout-closeout.csv and the exported LB/FB netlists close the 24-pin JFB1 FFC signal ownership reset/service behavior channel/status LEDs USB and optional OLED pinout,Closed: cable pinout signal ownership and both connector pad maps are date-stamped and validator-covered,Retain the accepted role-free JFB1 labels and same-side cable convention during controlled board import,Closed blocker; FB-100 board import is ready while cable bend and enclosure placement remain layout checks
USB service and ESD,FBREL-002,Closed,The floating USB_VBUS_DETECT_RAW defect temporarily made this gate Conditional; R13 3.9k R14 15k and C1 100nF now provide calculated 3.723 V minimum present 0.152 V maximum absent and 3.81 ms maximum removal time while USB remains sense-only,Closed: Schmitt threshold leakage tolerance timing exact topology footprint binding and zero-finding ERC are validator-covered,Preserve R13/R14/C1 the device-only no-back-power path and the differential/ESD placement rules during layout,Closed blocker after corrective evidence; controlled board import is ready but fabrication still waits for layout review
Indicators and controls,FBREL-003,Closed,FB-100-ui-control-closeout-precheck.csv and the accepted FB-100 schematic close ten role-free channel LEDs LTC3212-driven common-anode RGB buttons and optional OLED DNP values/topology,Closed: UI topology values pad binding button behavior and DNP OLED policy are validator-covered,Carry the accepted role-free UI nets into optical/mechanical placement without assigning output functions in hardware,Closed blocker; controlled board import is ready while brightness and actuator alignment remain layout/prototype checks
Mechanical and enclosure interface,FBREL-004,Closed,FB-100-mechanical-envelope-precheck.csv and FB-100-ui-mechanical-precheck.csv close prototype envelope mounting strategy USB access LED/button alignment optional OLED keep-out and service sealing boundary,Closed: mechanical envelope and placement constraints are captured without creating manufacturing artifacts,Use the closed envelope for controlled FB-100 outline and placement review,Closed blocker; board import is ready but the reviewed outline/layout is not yet a fabrication release
Factory assembly readiness,FBREL-005,Closed,FB-100-component-sourcing-precheck.csv records the accepted USB-C USB ESD RGB/channel LEDs FPC connector FFC cable buttons OLED passives and alternates/current source evidence,Closed: critical FB-100 factory/garage sourcing evidence component families and schematic values are date-stamped and validator-covered,Transfer accepted designators and values into the preliminary BOM while keeping LTC3212 sourcing and passive order-code lock as production actions,Closed blocker; BOM lock pick-place and JLCPCB/PCBWay order package remain blocked until layout and fabrication gates close
KiCad schematic implementation,FBREL-006,Closed,The missing raw pulldown temporarily made this gate Conditional; FB-100.kicad_sch now exports a 44-component 46-net footprint-bound XML netlist with typed IC pins USB-C ESD dual CC Rd defined-low VBUS detect role-free LEDs direct one-wire RGB buttons and optional OLED DNP,Closed: tools/validate_board_schematics.py checks exact R13/R14/C1 USB no-back-power UI button direct RGB topology symbol-to-footprint pads deterministic generation and zero-finding ERC,Carry the corrected schematic into controlled FB-100 board import and optical/mechanical placement review,Closed blocker after corrective evidence; manufacturing output and ordering remain NO-GO until layout and fabrication review
