Gate,Status,Evidence,Decision,Blocked action
Schematic freeze,Open,FB-100-schematic-freeze-checklist.md; FB-100-schematic-review-closeout.md,FB-100 schematic is still a text scaffold and cannot be frozen for PCB import,Do not create or update FB-100.kicad_pcb until value-bearing component capture and symbol promotion close
KiCad schematic value review,Open,kicad/FB-100.kicad_sch; FB-100-schematic-review-closeout.md,The current KiCad file contains requirements text but no component symbols or footprint-bound electrical instances,Do not use the FB-100 scaffold as a PCB netlist until reviewed component capture ERC and USB power-boundary review close
Footprint binding,Closed,FB-100-footprint-binding-inventory.csv; FB-100-footprint-binding-closeout.csv; FB-100-footprint-binding-closeout.md; kicad/lib/FB100.pretty,FB-100 project-local USB-C ESD FPC LED button OLED-DNP and passive footprints are reviewed and bound in the footprint inventory,Do not create or update FB-100.kicad_pcb until schematic symbol promotion also closes
Schematic symbol promotion,Open,kicad/FB-100.kicad_sch; kicad/lib/FB100.kicad_sym; FB-100-footprint-binding-closeout.md,FB-100 schematic remains a value-bearing text scaffold and no footprint-bound symbol instances exist yet; empty Footprint properties must not be hidden by local footprint files,Do not create or update FB-100.kicad_pcb until reviewed symbols with footprint properties replace the scaffold evidence
Mechanical envelope,Closed,FB-100-mechanical-envelope-inventory.csv; FB-100-mechanical-layout-inputs.csv; FB-100-mechanical-layout-input-closeout.md; FB-100-mechanical-envelope-precheck.csv; FB-100-ui-mechanical-precheck.csv,FB-100 USB-C edge outline mounting JFB1 cable exit LED button OLED and panelization mechanical layout inputs are reviewed,Do not create or update FB-100.kicad_pcb until footprint binding and USB/no-back-power layout model gates also close
DFM/DRC baseline,Ready,production/board-order/three_board_layout_rules.md,Use conservative JLCPCB/PCBWay-compatible layout-start rules and do not use vendor minimums as default design values,Do not relax trace spacing via package fiducial panel or edge-clearance rules without documented DFM review
USB and no-back-power layout model,Closed,FB-100-usb-no-back-power-layout-rules.csv; FB-100-usb-no-back-power-layout-closeout.md; FB-100-usb-service-closeout-precheck.csv; FB-100-interface-signal-plan.csv,USB D+/D- ESD CC VBUS sense shield return and no-back-power placement/routing constraints are reviewed,Do not connect USB VBUS to system rails or create a back-power path; do not create FB-100.kicad_pcb until footprint binding closes
Manufacturing output boundary,Closed,production/board-order/three_board_jlcpcb_order_readiness.csv; production/board-order/three_board_layout_start_readiness.csv,PCB layout-start work does not authorize fabrication assembly or order artifacts,Do not generate Gerbers drills pick-place BOM/CPL manufacturing ZIP fabrication package or PCBA order
